164,Sri Lanka,"An island country in South Asia known for its stunning beaches, ancient ruins, and vibrant cultural heritage.",Sri Lankan Rupee,0.0055,Visa,"Sinhala, Tamil",+94
165,Sudan,"A country in Northeast Africa known for its ancient civilization, diverse ethnic groups, and stunning landscapes.",Sudanese Pound,0.00042,ID,"Arabic, English",+249
166,Suriname,A small country on the northeastern coast of South America known for its diverse culture and pristine rainforests.,Surinamese Dollar,0.13,Passport,Dutch,+597
167,Swaziland,"A landlocked country in Southern Africa known for its stunning landscapes, wildlife, and rich cultural heritage.",Swazi Lilangeni,0.064,Visa,"Swazi, English",+268
168,Sweden,"A Scandinavian country known for its stunning landscapes, high standard of living, and progressive social policies.",Swedish Krona,0.097,Visa,Swedish,+46
169,Switzerland,"A landlocked country in Central Europe known for its stunning alpine scenery, chocolate, and watchmaking.",Swiss Franc,0.92,ID,"German, French, Italian, Romansh",+41
170,Syria,"A country in the Middle East known for its ancient ruins, rich history, and diverse cultural heritage.",Syrian Pound,0.0018,Visa,Arabic,+963
171,Taiwan,"An island country in East Asia known for its technological innovation, delicious street food, and vibrant culture.",New Taiwan Dollar,0.032,ID,Mandarin Chinese,+886
172,Tajikistan,"A landlocked country in Central Asia known for its stunning mountains, ancient Silk Road history, and warm hospitality.",Tajikistani Somoni,0.091,Passport,"Tajik, Russian",+992
173,Tanzania,"A country in East Africa known for its diverse wildlife, stunning landscapes, and rich cultural heritage.",Tanzanian Shilling,0.00039,Visa,"Swahili, English",+255
174,Thailand,"A country in Southeast Asia known for its stunning beaches, vibrant cities, and rich Buddhist heritage.",Thai Baht,0.032,Visa,Thai,+66
175,Timor-Leste,"A Southeast Asian country occupying half of the island of Timor, known for its rugged landscapes.",United States Dollar,0.91,Passport,"Tetum, Portuguese",+670
176,Togo,"A country in West Africa known for its diverse ethnic groups, beautiful coastline, and vibrant culture.",West African CFA Franc,0.0017,Passport,French,+228
177,Tonga,"A Polynesian kingdom in the South Pacific known for its pristine beaches, warm hospitality, and unique culture.",Tongan Paʻanga,0.41,ID,"Tongan, English",+676
178,Trinidad and Tobago,A twin-island country in the Caribbean known for its vibrant Carnival celebrations and beautiful beaches.,Trinidad and Tobago Dollar,0.15,Visa,English,+1-868
179,Tunisia,"A country located in North Africa known for its beautiful Mediterranean coastline, ancient ruins, and vibrant souks.",Tunisian Dinar,0.34,ID,Arabic,+216
180,Turkey,"A transcontinental country bridging Europe and Asia known for its rich history, cultural heritage, and delicious cuisine.",Turkish Lira,0.11,Visa,Turkish,+90
181,Turkmenistan,"A country in Central Asia known for its ancient Silk Road cities, vast deserts, and unique landscapes.",Turkmenistan Manat,0.26,Visa,"Turkmen, Russian",+993
182,Tuvalu,"A small island country in the Pacific Ocean known for its remote location, pristine beaches, and warm hospitality.",Australian Dollar,0.64,ID,"Tuvaluan, English",+688
183,Uganda,"A landlocked country in East Africa known for its diverse wildlife, stunning landscapes, and warm hospitality.",Ugandan Shilling,0.00026,Passport,"English, Swahili",+256
184,Ukraine,"A country in Eastern Europe known for its diverse landscapes, rich cultural heritage, and historic sites.",Ukrainian Hryvnia,0.036,ID,Ukrainian,+380
185,United Arab Emirates,"A country located on the southeastern coast of the Arabian Peninsula known for its modern cities, luxury lifestyle, and cultural heritage.",United Arab Emirates Dirham,0.24,Visa,Arabic,+971
186,United Kingdom,"A country in Western Europe known for its rich history, iconic landmarks, and cultural contributions.",British Pound,1.21,ID,English,+44
187,United States,"A country in North America known for its diverse landscapes, cultural melting pot, and global influence.",United States Dollar,1.0,Visa,English,+1
188,Uruguay,"A country in South America known for its beautiful beaches, vibrant culture, and progressive social policies.",Uruguayan Peso,0.023,ID,Spanish,+598
189,Uzbekistan,"A landlocked country in Central Asia known for its ancient cities, Silk Road history, and diverse cultural heritage.",Uzbekistani Som,0.087,ID,"Uzbek, Russian",+998
190,Vanuatu,"A Pacific island nation known for its stunning coral reefs, volcanic landscapes, and vibrant Melanesian culture.",Vanuatu Vatu,0.0082,ID,"Bislama, English, French",+678
191,Vatican City,The world's smallest independent city-state and spiritual center of the Roman Catholic Church.,Euro,1.0,Visa,"Italian, Latin",+379
192,Venezuela,A country located on the northern coast of South America known for its diverse landscapes and rich cultural heritage.,Venezuelan Bolívar,0.00012,Visa,Spanish,+58
193,Vietnam,"A country in Southeast Asia known for its ancient temples, bustling cities, delicious street food, and natural beauty.",Vietnamese Đồng,4.1e-05,Visa,Vietnamese,+84
194,Yemen,"A country in the Middle East known for its ancient history, diverse landscapes, and unique cultural heritage.",Yemeni Rial,0.0036,Passport,Arabic,+967
195,Zambia,"A landlocked country in Southern Africa known for its stunning landscapes, diverse wildlife, and vibrant culture.",Zambian Kwacha,0.041,Passport,English,+260
196,Zimbabwe,"A landlocked country in Southern Africa known for its diverse wildlife, stunning landscapes, and rich cultural heritage.",Zimbabwean Dollar,0.0011,Passport,"English, Shona, Ndebele",+263
