352,Visby,"A city in Sweden known for its well-preserved medieval city walls, beautiful cobblestone streets, and the annual Medieval Week.",22044,168
353,Örebro,"A city in Sweden famous for its historic Örebro Castle, beautiful parks, and vibrant cultural events.",57969,168
354,Linköping,"A city in Sweden known for its historic Linköping Cathedral, beautiful gardens, and being a center for technology and innovation.",69388,168
355,Västerås,"A city in Sweden famous for its historic sites like the Västerås Cathedral, beautiful Lake Mälaren, and vibrant festivals.",2824,168
356,Helsingborg,"A city in Sweden known for its beautiful waterfront, historic landmarks like the Kärnan tower, and the stunning Sofiero Palace and Gardens.",28838,168
357,Norrköping,"A city in Sweden famous for its vibrant industrial heritage, beautiful riverside promenade, and vibrant cultural scene.",65904,168
358,Jönköping,"A city in Sweden known for its beautiful lakeside location, historic landmarks like the Jönköping Castle, and the annual DreamHack festival.",36619,168
359,Zurich,"The largest city in Switzerland known for its vibrant arts and culture scene, beautiful Lake Zurich, and the historic old town.",12738,169
360,Geneva,"A city in Switzerland famous for its diplomatic significance, stunning Lake Geneva, and the iconic Jet d'Eau.",48827,169
361,Bern,"The capital city of Switzerland known for its well-preserved medieval old town, beautiful Aare River, and the Federal Palace.",9932,169
362,Basel,"A city in Switzerland famous for its rich history, beautiful Rhine River, and the annual Art Basel fair.",96918,169
363,Lucerne,"A city in Switzerland known for its picturesque location on Lake Lucerne, stunning mountain views, and the famous Chapel Bridge.",33440,169
364,Lausanne,"A city in Switzerland famous for its beautiful lakeside location, vibrant cultural scene, and being the headquarters of the International Olympic Committee.",54989,169
365,Zermatt,"A city in Switzerland known for its iconic Matterhorn mountain, world-class skiing, and charming car-free village.",14657,169
366,Interlaken,"A city in Switzerland famous for its stunning mountain scenery, adventure sports opportunities, and the beautiful Jungfrau region.",18451,169
367,Istanbul,"The largest city in Turkey known for its rich history, stunning architecture like the Hagia Sophia, and vibrant cultural scene.",42264,180
368,Ankara,"The capital city of Turkey known for its modern architecture, historic sites like the Ataturk Mausoleum, and being the political and administrative center of the country.",4378,180
369,Izmir,"A city in Turkey famous for its beautiful waterfront, vibrant street life, and historic landmarks like the ancient city of Ephesus.",7487,180
370,Antalya,"A city in Turkey known for its stunning Mediterranean coastline, beautiful beaches, and ancient ruins like the Roman-era Aspendos Theater.",14685,180
371,London,"The capital city of the United Kingdom known for its iconic landmarks like the Big Ben, Buckingham Palace, and the Tower of London.",60146,186
372,Edinburgh,"The capital city of Scotland known for its historic sites like Edinburgh Castle, beautiful Royal Mile, and vibrant arts and festival scene.",93666,186
373,Manchester,"A city in England famous for its vibrant music and sports scene, beautiful Victorian architecture, and the iconic Manchester United football club.",71779,186
374,Birmingham,"A city in England known for its rich industrial heritage, beautiful canals, and vibrant cultural scene.",15602,186
375,Glasgow,"A city in Scotland famous for its vibrant music and arts scene, beautiful Victorian architecture, and being the birthplace of renowned architect Charles Rennie Mackintosh.",67142,186
376,Liverpool,"A city in England known for its rich maritime history, vibrant music scene, and being the birthplace of The Beatles.",90136,186
377,Bristol,"A city in England famous for its vibrant street art, beautiful harborside, and historic landmarks like the Clifton Suspension Bridge.",83055,186
378,Oxford,"A city in England known for its prestigious university, beautiful architecture like the Radcliffe Camera, and being a hub of academic and literary heritage.",95000,186
379,Cambridge,"A city in England famous for its prestigious university, beautiful colleges, and picturesque River Cam.",29098,186
380,New York City,"The largest city in the United States known for its iconic landmarks like Times Square, Statue of Liberty, and Central Park.",96740,187
381,Los Angeles,"A city in the United States famous for its vibrant entertainment industry, beautiful beaches like Venice Beach, and iconic sites like the Hollywood Sign.",77854,187
382,Chicago,"A city in the United States known for its stunning architecture, vibrant arts scene, and being a hub of blues and jazz music.",96440,187
383,San Francisco,"A city in the United States famous for its iconic Golden Gate Bridge, vibrant cultural scene, and historic sites like Alcatraz Island.",87751,187
384,Las Vegas,"A city in the United States known for its vibrant nightlife, world-class casinos, and iconic entertainment shows.",3135,187
385,Miami,"A city in the United States famous for its beautiful beaches, vibrant Art Deco architecture in the South Beach area, and lively Latin American cultural scene.",59980,187
386,"Washington, D.C.","The capital city of the United States known for its historic landmarks like the White House, U.S. Capitol, and the National Mall.",54521,187
387,Boston,"A city in the United States known for its prestigious universities, historic sites like the Freedom Trail, and being a hub of American history and culture.",75031,187
388,Ho Chi Minh City,"The largest city in Vietnam known for its bustling street life, historic landmarks like the Reunification Palace, and vibrant food scene.",79293,193
389,Hanoi,"The capital city of Vietnam known for its rich history, beautiful Old Quarter, and being a hub of Vietnamese culture and cuisine.",1134,193
390,Da Nang,"A city in Vietnam famous for its stunning beaches, beautiful Marble Mountains, and vibrant Dragon Bridge.",37935,193
391,Hoi An,"A city in Vietnam known for its well-preserved ancient town, beautiful lantern-lit streets, and being a UNESCO World Heritage site.",87584,193
392,Nha Trang,"A city in Vietnam famous for its pristine beaches, vibrant coral reefs, and the iconic Po Nagar Cham Towers.",95791,193
393,Phu Quoc,"An island city in Vietnam known for its stunning beaches, vibrant night markets, and being a popular tourist destination.",80883,193
394,Hue,"A city in Vietnam famous for its historic Imperial City, beautiful Perfume River, and being a UNESCO World Heritage site.",45390,193
395,Vung Tau,"A city in Vietnam known for its beautiful beaches, vibrant seafood markets, and the scenic Vung Tau Lighthouse.",8281,193
396,Can Tho,"A city in Vietnam famous for its bustling floating markets, beautiful canal networks, and the iconic Ninh Kieu Wharf.",46492,193
397,Haiphong,"A city in Vietnam known for its vibrant port, beautiful Do Son Beach, and being the gateway to the stunning Halong Bay.",71145,193
398,Bogotá,"The capital city of Colombia known for its historic district, vibrant street art scene, and beautiful Monserrate Hill.",8347,37
399,Medellín,"A city in Colombia famous for its transformation into a vibrant cultural and innovation hub, beautiful views from the Metrocable, and the annual Feria de las Flores festival.",16729,37
400,Cali,"A city in Colombia known for its lively salsa music and dance scene, beautiful views from the Cristo Rey monument, and the iconic San Antonio neighborhood.",69645,37
401,Cartagena,"A city in Colombia famous for its well-preserved colonial architecture, stunning beaches like Playa Blanca, and vibrant Caribbean culture.",34254,37
402,Barranquilla,"A city in Colombia known for its vibrant Carnaval de Barranquilla, beautiful malecón along the Magdalena River, and being the birthplace of Shakira.",61685,37
403,Santa Marta,"A city in Colombia famous for its stunning beaches, including the iconic Playa Cristal, and being the gateway to the majestic Sierra Nevada de Santa Marta.",51892,37
404,Manizales,"A city in Colombia known for its beautiful mountain views, vibrant coffee culture, and being the capital of the Caldas department.",93745,37
405,Pereira,"A city in Colombia famous for its coffee plantations, scenic hot springs, and being the capital of the Risaralda department.",83399,37
406,Zagreb,"The capital city of Croatia known for its historic Upper Town, beautiful parks like Maksimir Park, and vibrant cultural scene.",94841,42
407,Split,"A city in Croatia famous for its well-preserved Roman ruins, stunning Diocletian's Palace, and beautiful waterfront promenade, Riva.",2211,42
408,Dubrovnik,"A city in Croatia known for its UNESCO-listed Old Town, historic city walls, and stunning views of the Adriatic Sea.",36480,42
409,Zadar,"A city in Croatia famous for its Roman and Venetian ruins, unique Sea Organ, and beautiful sunsets at the Greeting to the Sun.",35842,42
410,Pula,"A city in Croatia known for its well-preserved Roman amphitheater, beautiful beaches, and the vibrant Pula Film Festival.",24040,42
411,Rijeka,"A city in Croatia famous for its vibrant carnival, beautiful Trsat Castle, and being the gateway to the stunning Kvarner Bay.",75219,42
412,Osijek,"A city in Croatia known for its rich history, beautiful Baroque architecture, and vibrant cultural festivals.",30394,42
413,Šibenik,"A city in Croatia famous for its stunning Cathedral of St. James, beautiful waterfront promenade, and being a filming location for Game of Thrones.",59088,42
414,Varaždin,"A city in Croatia known for its well-preserved Baroque architecture, beautiful castle, and vibrant music scene.",95694,42
415,Bangkok,"The capital city of Thailand known for its bustling street markets, stunning temples like Wat Arun, and vibrant nightlife.",10201,174
416,Chiang Mai,"A city in Thailand famous for its beautiful temples, vibrant night bazaars, and being a hub of traditional Thai arts and crafts.",83520,174
417,Phuket,"A city in Thailand known for its stunning beaches, vibrant nightlife in Patong, and being a popular tourist destination.",28574,174
418,Krabi,"A city in Thailand famous for its beautiful limestone cliffs, pristine beaches like Railay Beach, and vibrant marine life.",35400,174
419,Pattaya,"A city in Thailand known for its beautiful beaches, lively entertainment scene, and vibrant nightlife.",11975,174
420,Ayutthaya,"A city in Thailand famous for its historic ruins, including the UNESCO-listed Ayutthaya Historical Park, and its rich cultural heritage.",37552,174
421,Hua Hin,"A city in Thailand known for its beautiful beaches, stunning royal palace, and vibrant night markets.",74256,174
422,Koh Samui,"An island city in Thailand famous for its pristine beaches, vibrant nightlife in Chaweng, and the iconic Big Buddha Temple.",48902,174
