180,George Town,"A city in Penang, Malaysia famous for its well-preserved colonial architecture, vibrant street art, and delicious local cuisine.",28541,103
181,Kota Kinabalu,"A city in Sabah, Malaysia known for its stunning beaches, vibrant night markets, and proximity to Mount Kinabalu.",51250,103
182,Malacca City,"The capital city of Malacca, Malaysia famous for its rich history, UNESCO-listed historic center, and vibrant Baba-Nyonya culture.",9634,103
183,Johor Bahru,"A city in Johor, Malaysia known for its modern skyline, vibrant shopping malls, and proximity to Singapore.",34455,103
184,Ipoh,"A city in Perak, Malaysia famous for its delicious street food, colonial-era architecture, and limestone hills.",87029,103
185,Langkawi,"An archipelago and resort destination in Malaysia famous for its beautiful beaches, lush rainforests, and duty-free shopping.",13186,103
186,Kuching,"The capital city of Sarawak, Malaysia known for its vibrant waterfront, cultural diversity, and proximity to Borneo's rainforests.",74835,103
187,Kuantan,"A city in Pahang, Malaysia famous for its beautiful beaches, vibrant night markets, and delicious local seafood.",45118,103
188,Sandakan,"A city in Sabah, Malaysia known for its wildlife-rich rainforests, historic landmarks, and famous orangutan rehabilitation centers.",27994,103
189,Taiping,"A town in Perak, Malaysia famous for its beautiful lake gardens, colonial-era architecture, and peaceful atmosphere.",97029,103
190,Mexico City,"The capital city of Mexico known for its rich history, vibrant culture, and UNESCO-listed historic center, including the iconic Zocalo square.",20503,110
191,Cancun,"A popular resort city in Mexico known for its stunning beaches, crystal-clear turquoise waters, and vibrant nightlife.",69150,110
192,Guadalajara,"The second-largest city in Mexico known for its vibrant arts scene, rich culinary heritage, and historic landmarks like the Guadalajara Cathedral.",41206,110
193,Monterrey,"A city in northeastern Mexico famous for its modern skyline, vibrant industrial sector, and stunning natural landscapes.",81959,110
194,Puebla,"A city in central Mexico known for its well-preserved colonial architecture, colorful Talavera pottery, and delicious local cuisine.",5975,110
195,Tijuana,"A city on the Mexico-United States border known for its vibrant cultural scene, bustling street markets, and delicious street food.",49589,110
196,Mérida,"The capital city of Yucatán, Mexico known for its well-preserved colonial architecture, Mayan heritage, and vibrant cultural festivals.",79549,110
197,Oaxaca,"A city in southern Mexico famous for its rich indigenous heritage, colorful markets, and traditional arts and crafts.",75021,110
198,Playa del Carmen,"A coastal resort town in Mexico's Riviera Maya known for its beautiful beaches, vibrant nightlife, and world-class diving.",32462,110
199,Puerto Vallarta,"A resort city on Mexico's Pacific coast known for its stunning beaches, vibrant Old Town, and breathtaking sunsets.",20367,110
200,San Miguel de Allende,"A city in central Mexico famous for its well-preserved colonial architecture, vibrant art scene, and charming cobblestone streets.",26183,110
201,Marrakech,"A city in Morocco known for its vibrant medina (old town), bustling souks, and iconic landmarks like the Koutoubia Mosque and Jardin Majorelle.",26536,116
202,Fez,"A city in Morocco famous for its well-preserved medieval architecture, historic medina (Fes el-Bali), and vibrant tanneries.",23334,116
203,Casablanca,"The largest city in Morocco known for its modern architecture, vibrant street life, and iconic Hassan II Mosque.",56858,116
204,Chefchaouen,"A city in northwest Morocco famous for its stunning blue-washed streets, traditional handicrafts, and beautiful mountain views.",30709,116
205,Essaouira,"A coastal city in Morocco known for its picturesque medina, beautiful beaches, and vibrant music festivals.",64797,116
206,Agadir,"A city in southwest Morocco famous for its stunning beaches, vibrant souks, and proximity to the Atlas Mountains.",76276,116
207,Rabat,"The capital city of Morocco known for its historic landmarks like the Royal Palace and Hassan Tower, as well as its vibrant arts scene.",11921,116
208,Tangier,"A city in northern Morocco known for its strategic location on the Strait of Gibraltar, historic medina, and cosmopolitan atmosphere.",52184,116
209,Meknes,"A city in Morocco famous for its well-preserved historic medina, beautiful gates, and impressive royal stables.",21411,116
210,Ouarzazate,"A city in Morocco known for its stunning desert landscapes, kasbahs, and being a popular filming location for movies and TV shows.",20189,116
211,Ifrane,"A city in the Middle Atlas region of Morocco famous for its Swiss-like architecture, clean streets, and beautiful surrounding forests.",90059,116
212,Amsterdam,"The capital city of the Netherlands known for its picturesque canals, historic architecture, and vibrant cultural scene.",66612,122
213,Rotterdam,"A city in the Netherlands famous for its modern architecture, bustling port, and vibrant arts scene.",5614,122
214,The Hague,"The administrative capital of the Netherlands known for its government buildings, historic landmarks like the Binnenhof, and beautiful beaches.",91533,122
215,Utrecht,"A city in the Netherlands famous for its well-preserved historic center, beautiful canals, and vibrant cultural events.",37218,122
216,Eindhoven,"A city in the Netherlands known for its innovative technology industry, vibrant design scene, and cultural festivals.",50241,122
217,Maastricht,"A city in the Netherlands famous for its historic architecture, vibrant culinary scene, and lively cultural events.",27594,122
218,Auckland,"The largest city in New Zealand known for its stunning harbors, vibrant arts scene, and diverse culinary offerings.",35898,123
219,Wellington,"The capital city of New Zealand known for its picturesque harbor, vibrant cultural scene, and thriving coffee culture.",21818,123
220,Christchurch,"A city in New Zealand famous for its English heritage, beautiful gardens, and vibrant arts and music scene.",32879,123
221,Queenstown,"A resort town in New Zealand's South Island known for its stunning alpine scenery, adventure activities, and vibrant nightlife.",83491,123
222,Rotorua,"A city in New Zealand famous for its geothermal wonders, Maori culture, and adventure activities like zorbing and hiking.",2385,123
223,Dunedin,"A city in New Zealand known for its Scottish heritage, beautiful architecture, and vibrant student culture.",15269,123
224,Hamilton,"A city in New Zealand famous for its beautiful gardens, vibrant arts scene, and the iconic Hamilton Gardens.",12990,123
225,Napier,"A city in New Zealand known for its Art Deco architecture, beautiful beaches, and thriving wine region.",59352,123
226,Tauranga,"A city in New Zealand famous for its beautiful beaches, vibrant waterfront, and proximity to Mount Maunganui.",34902,123
227,Nelson,"A city in New Zealand known for its sunny climate, stunning beaches, and vibrant arts and crafts scene.",17011,123
228,Oslo,"The capital city of Norway known for its stunning fjords, vibrant cultural scene, and historic landmarks like the Viking Ship Museum.",38492,129
229,Bergen,"A city in Norway famous for its picturesque waterfront, stunning surrounding mountains, and colorful wooden houses in the historic Bryggen district.",37532,129
230,Trondheim,"A city in Norway known for its well-preserved medieval architecture, vibrant music scene, and historic Nidaros Cathedral.",91878,129
231,Stavanger,"A city in Norway famous for its beautiful beaches, stunning fjords, and proximity to the famous Pulpit Rock.",73231,129
232,Tromso,"A city in northern Norway known for its stunning natural landscapes, vibrant Northern Lights, and lively cultural scene.",43382,129
233,Bodo,"A city in Norway famous for its beautiful coastal landscapes, white sandy beaches, and opportunities for outdoor activities like hiking and fishing.",35868,129
234,Kristiansand,"A city in Norway known for its charming old town, beautiful beaches, and vibrant summer music festivals.",8789,129
235,Alesund,"A city in Norway famous for its art nouveau architecture, stunning views of the surrounding islands, and vibrant maritime history.",60611,129
236,Haugesund,"A city in Norway known for its rich Viking heritage, beautiful coastal landscapes, and the annual Norwegian International Film Festival.",96207,129
237,Lima,"The capital city of Peru known for its rich history, vibrant culinary scene, and historic landmarks like the Plaza de Armas and Larco Museum.",24343,136
238,Cusco,"A city in Peru famous for its well-preserved Inca ruins, including Machu Picchu, and vibrant Andean culture.",57173,136
239,Arequipa,"A city in Peru known for its stunning colonial architecture, including the famous Santa Catalina Monastery, and proximity to the picturesque Colca Canyon.",54022,136
240,Iquitos,"A city in the Peruvian Amazon known for its vibrant riverfront, bustling Belén Market, and opportunities for jungle adventures.",89225,136
241,Trujillo,"A city in Peru famous for its well-preserved pre-Columbian archaeological sites, beautiful colonial architecture, and vibrant traditional festivals.",65739,136
242,Puno,"A city in Peru known for its location on the shores of Lake Titicaca, the highest navigable lake in the world, and its vibrant folkloric traditions.",63914,136
243,Puerto Maldonado,"A city in the Peruvian Amazon known for its rich biodiversity, lush rainforests, and opportunities for wildlife encounters.",62321,136
244,Chiclayo,"A city in Peru famous for its ancient archaeological sites like the Royal Tombs of Sipán, vibrant markets, and delicious regional cuisine.",36704,136
245,Manila,"The capital city of the Philippines known for its bustling street life, historic landmarks like Intramuros, and vibrant cultural scene.",81289,137
246,Cebu City,"A city in the Philippines famous for its beautiful beaches, vibrant nightlife, and historic landmarks like the Magellan's Cross.",73497,137
247,Davao City,"A city in the Philippines known for its vibrant cultural heritage, beautiful parks and gardens, and proximity to Mount Apo, the country's highest peak.",8575,137
248,Boracay,"A popular island destination in the Philippines known for its stunning white sand beaches, crystal-clear turquoise waters, and vibrant water sports scene.",76955,137
249,Palawan,"A province in the Philippines famous for its pristine beaches, stunning limestone cliffs, and the UNESCO-listed Puerto Princesa Subterranean River National Park.",36234,137
250,Baguio,"A city in the Philippines known for its cool climate, scenic mountain views, and vibrant arts and crafts scene.",93292,137
251,Cagayan de Oro,"A city in the Philippines famous for its white water rafting opportunities, beautiful natural landscapes, and vibrant festivals.",57228,137
252,Angeles City,"A city in the Philippines known for its vibrant nightlife, entertainment district, and proximity to the historic Mount Pinatubo.",49647,137
253,Iloilo City,"A city in the Philippines famous for its rich Spanish colonial heritage, beautiful churches, and vibrant culinary scene.",22869,137
254,Batangas City,"A city in the Philippines known for its beautiful beaches, dive sites, and the stunning Taal Volcano, located in nearby Taal Lake.",15536,137
255,Warsaw,"The capital city of Poland known for its rich history, beautiful Old Town, and cultural attractions like the Royal Castle and Lazienki Park.",66980,138
256,Krakow,"A city in Poland famous for its well-preserved medieval architecture, including the iconic Wawel Castle and the historic Main Market Square.",48626,138
257,Gdansk,"A city in Poland known for its rich maritime heritage, beautiful old town, and historic shipyards, including the iconic Gdansk Crane.",86977,138
258,Wroclaw,"A city in Poland famous for its stunning Gothic architecture, beautiful Market Square, and vibrant cultural scene.",70050,138
259,Poznan,"A city in Poland known for its vibrant Old Town, historic landmarks like the Imperial Castle, and lively cultural events.",16818,138
260,Lodz,"A city in Poland famous for its industrial heritage, vibrant street art, and revitalized factory spaces hosting cultural events.",27161,138
261,Katowice,"A city in Poland known for its modern architecture, vibrant cultural scene, and proximity to the picturesque Beskidy Mountains.",69876,138
262,Szczecin,"A city in Poland famous for its maritime history, beautiful parks, and stunning Gothic and Renaissance architecture.",69382,138
263,Gdynia,"A coastal city in Poland known for its beautiful beaches, modernist architecture, and the bustling port.",49401,138
264,Bydgoszcz,"A city in Poland famous for its beautiful riverside location, historic buildings, and vibrant music and arts scene.",73189,138
265,Torun,"A city in Poland known for its well-preserved medieval architecture, including the iconic Copernicus House, and its gingerbread tradition.",20345,138
266,Lisbon,"The capital city of Portugal known for its colorful neighborhoods, historic landmarks like the Belém Tower and Jerónimos Monastery, and vibrant Fado music.",6447,139
267,Porto,"A city in Portugal famous for its historic city center, beautiful Douro River, and its renowned Port wine production.",36605,139
268,Faro,"A city in Portugal known for its picturesque old town, beautiful beaches, and being the gateway to the stunning Algarve region.",13710,139
269,Coimbra,"A city in Portugal famous for its historic university, well-preserved medieval architecture, and vibrant student atmosphere.",47541,139
270,Madeira,"A Portuguese archipelago known for its lush landscapes, stunning cliffs, and beautiful Levada walking trails.",96979,139
271,Evora,"A city in Portugal famous for its well-preserved Roman ruins, including the Temple of Diana, and its historic center, a UNESCO World Heritage site.",70126,139
272,Braga,"A city in Portugal known for its rich religious heritage, beautiful Baroque architecture, and vibrant cultural festivals.",11753,139
273,Aveiro,"A city in Portugal famous for its picturesque canals, colorful Moliceiro boats, and the stunning Costa Nova beach.",39069,139
274,Sintra,"A town in Portugal known for its fairytale-like castles and palaces, including the famous Pena Palace and the Quinta da Regaleira.",4153,139
275,Funchal,"The capital city of Madeira, Portugal known for its beautiful harbor, stunning gardens, and vibrant New Year's Eve celebrations.",46248,139
276,Viseu,"A city in Portugal famous for its charming historic center, beautiful gardens, and the stunning Grão Vasco Museum.",22909,139
277,Cascais,"A coastal town in Portugal known for its beautiful beaches, elegant mansions, and vibrant marina.",94085,139
278,Moscow,"The capital city of Russia known for its iconic landmarks like the Red Square and the Kremlin, vibrant cultural scene, and historic architecture.",68046,142
279,Saint Petersburg,"A city in Russia famous for its stunning palaces, beautiful canals, and world-class museums, including the Hermitage Museum.",45111,142
280,Novosibirsk,"A city in Russia known for its vibrant arts and theater scene, beautiful parks, and the famous Novosibirsk Opera and Ballet Theatre.",26485,142
281,Yekaterinburg,"A city in Russia famous for its rich history, vibrant cultural scene, and proximity to the Ural Mountains and the Europe-Asia border.",6818,142
282,Kazan,"A city in Russia known for its rich Tatar heritage, beautiful mosques, and the UNESCO-listed Kazan Kremlin.",76496,142
283,Nizhny Novgorod,"A city in Russia famous for its historic architecture, vibrant cultural scene, and the annual Nizhny Novgorod Fair.",78022,142
284,Sochi,"A city in Russia known for its stunning Black Sea coastline, beautiful beaches, and hosting the 2014 Winter Olympics.",27408,142
285,Riyadh,"The capital city of Saudi Arabia known for its modern skyline, bustling souks, and historic landmarks like the Masmak Fortress.",43921,150
286,Jeddah,"A city in Saudi Arabia famous for its beautiful waterfront, vibrant commercial center, and the iconic King Fahd Fountain.",43298,150
287,Mecca,"A city in Saudi Arabia known as the holiest city in Islam, home to the Masjid al-Haram and the Kaaba.",89366,150
288,Medina,"A city in Saudi Arabia famous for its significance in Islamic history, including the Prophet's Mosque and the burial place of Prophet Muhammad.",86377,150
289,Dammam,"A city in Saudi Arabia known for its modern skyline, beautiful waterfront, and proximity to the stunning Half Moon Bay.",76565,150
290,Abha,"A city in Saudi Arabia famous for its cool climate, scenic mountain views, and vibrant Asir National Park.",51079,150
291,Taif,"A city in Saudi Arabia known for its cool climate, beautiful gardens, and the annual Taif Rose Festival.",43998,150
292,Tabuk,"A city in Saudi Arabia famous for its stunning desert landscapes, ancient rock art, and proximity to the Red Sea.",55631,150
293,Singapore,"The capital city of Singapore known for its modern skyline, vibrant street food scene, and iconic landmarks like Marina Bay Sands and Gardens by the Bay.",73223,155
294,Sentosa,"An island resort in Singapore famous for its beautiful beaches, family-friendly attractions, and the iconic Universal Studios Singapore.",66627,155
295,Chinatown,"A vibrant district in Singapore known for its rich heritage, colorful temples, and delicious local cuisine.",77136,155
296,Little India,"A cultural enclave in Singapore known for its vibrant street life, traditional Indian shops, and the bustling Tekka Centre.",42568,155
297,Marina Bay,"A waterfront district in Singapore famous for its stunning skyline views, luxurious hotels, and the iconic Merlion statue.",41170,155
298,Clarke Quay,"A riverside quay in Singapore known for its vibrant nightlife, waterfront restaurants, and entertainment venues.",66648,155
299,Gardens by the Bay,"A famous attraction in Singapore known for its futuristic Supertrees, beautiful flower domes, and stunning waterfront views.",23019,155
300,Cape Town,"The legislative capital of South Africa known for its stunning natural beauty, including Table Mountain and beautiful beaches like Clifton and Camps Bay.",69124,160
301,Johannesburg,"The largest city in South Africa known for its vibrant cultural scene, bustling markets, and historic sites like the Apartheid Museum.",10081,160
302,Durban,"A city in South Africa famous for its beautiful beaches, vibrant waterfront, and the iconic Moses Mabhida Stadium.",32795,160
303,Pretoria,"The administrative capital of South Africa known for its historic landmarks like the Union Buildings, beautiful gardens, and vibrant arts scene.",24964,160
304,Port Elizabeth,"A city in South Africa known for its beautiful beaches, the stunning Addo Elephant National Park, and its vibrant cultural festivals.",20954,160
305,Bloemfontein,"The judicial capital of South Africa known for its historic landmarks like the National Women's Monument, beautiful gardens, and its role as the birthplace of the ANC.",62231,160
306,East London,"A city in South Africa famous for its beautiful beaches, the stunning Nahoon Reef for surfing, and the East London Museum.",96647,160
307,Stellenbosch,"A town in South Africa known for its beautiful vineyards, historic Cape Dutch architecture, and being the heart of the Cape Winelands.",82770,160
308,Kimberley,"A city in South Africa famous for its diamond mining history, the Big Hole, and the Kimberley Mine Museum.",48244,160
309,Nelspruit,"A city in South Africa known as the gateway to Kruger National Park, famous for its wildlife, stunning landscapes, and diverse flora and fauna.",66519,160
310,Polokwane,"A city in South Africa famous for its rich cultural heritage, beautiful wildlife reserves, and being the gateway to the northern part of the country.",70100,160
311,George,"A city in South Africa known for its scenic beauty, including the stunning Outeniqua Mountains, beautiful beaches, and golf courses.",33653,160
312,Seoul,"The capital city of South Korea known for its futuristic architecture, vibrant street markets, and historic palaces like Gyeongbokgung.",81681,161
313,Busan,"A city in South Korea famous for its beautiful beaches, vibrant seafood markets, and the iconic Busan Tower.",5704,161
314,Incheon,"A city in South Korea known for its modern architecture, vibrant Chinatown, and being the gateway to Incheon International Airport.",54278,161
315,Daegu,"A city in South Korea famous for its historic sites like the Donghwasa Temple, beautiful mountains, and vibrant fashion scene.",42525,161
316,Daejeon,"A city in South Korea known for its modern landmarks like the Daejeon Convention Center, beautiful parks, and vibrant scientific and educational institutions.",68453,161
317,Gwangju,"A city in South Korea famous for its vibrant arts and culture scene, historic sites like the Gwangju Biennale Hall, and beautiful parks.",77049,161
318,Ulsan,"A city in South Korea known for its industrial significance, beautiful coastal scenery, and the scenic Ganjeolgot Sunrise Park.",61078,161
319,Suwon,"A city in South Korea famous for its UNESCO-listed Hwaseong Fortress, vibrant traditional markets, and the popular Suwon World Cup Stadium.",37077,161
320,Changwon,"A city in South Korea known for its beautiful parks, vibrant cultural festivals, and the scenic Gyeongnam Masan Robot Land.",50772,161
321,Seongnam,"A city in South Korea famous for its modern residential complexes, vibrant shopping districts, and the Seongnam Arts Center.",25223,161
322,Madrid,"The capital city of Spain known for its vibrant nightlife, world-class museums like the Prado, and historic landmarks like the Royal Palace.",45988,163
323,Barcelona,"A city in Spain famous for its stunning architecture, including the iconic Sagrada Familia and Park Güell, beautiful beaches, and vibrant street life.",62069,163
324,Seville,"A city in Spain known for its rich history, stunning Moorish architecture, and lively flamenco scene.",95038,163
325,Valencia,"A city in Spain famous for its modern City of Arts and Sciences, beautiful beaches, and the vibrant Fallas festival.",47171,163
326,Malaga,"A city in Spain known for its beautiful beaches, vibrant cultural scene, and being the birthplace of Pablo Picasso.",54171,163
327,Bilbao,"A city in Spain famous for its iconic Guggenheim Museum, delicious Basque cuisine, and vibrant artistic and industrial heritage.",60934,163
328,Granada,"A city in Spain known for its breathtaking Alhambra palace, historic Moorish quarter, and vibrant tapas culture.",48112,163
329,Palma de Mallorca,"The capital city of the Balearic Islands in Spain known for its stunning beaches, historic old town, and vibrant nightlife.",59950,163
330,Ibiza,"An island in Spain famous for its vibrant nightlife, beautiful beaches, and UNESCO-listed old town, Dalt Vila.",26348,163
331,Cordoba,"A city in Spain known for its stunning Mezquita cathedral, beautiful Moorish architecture, and vibrant Andalusian culture.",67463,163
332,Toledo,"A city in Spain famous for its well-preserved medieval architecture, including the famous Toledo Cathedral and Alcázar, and its rich cultural heritage.",84348,163
333,Alicante,"A city in Spain known for its beautiful beaches, vibrant waterfront promenade, and the historic Santa Bárbara Castle.",73846,163
334,San Sebastian,"A city in Spain famous for its beautiful beaches, world-renowned gastronomy, and the annual San Sebastian International Film Festival.",41013,163
335,Colombo,"The capital city of Sri Lanka known for its bustling markets, historic landmarks like the Gangaramaya Temple, and beautiful Galle Face Green.",65736,164
336,Kandy,"A city in Sri Lanka famous for its beautiful lake, historic Temple of the Tooth, and vibrant Esala Perahera festival.",32580,164
337,Galle,"A city in Sri Lanka known for its well-preserved Dutch colonial architecture, beautiful fort, and picturesque beaches.",39241,164
338,Nuwara Eliya,"A city in Sri Lanka famous for its cool climate, lush tea plantations, and beautiful landscapes, often referred to as 'Little England'.",43227,164
339,Anuradhapura,"A city in Sri Lanka known for its ancient ruins, including the sacred Bodhi tree, and its rich Buddhist heritage.",85680,164
340,Polonnaruwa,"A city in Sri Lanka famous for its well-preserved ancient ruins, including the Royal Palace and the Gal Vihara.",30207,164
341,Dambulla,"A city in Sri Lanka known for its magnificent cave temples, including the famous Dambulla Cave Temple, a UNESCO World Heritage site.",71772,164
342,Sigiriya,"A city in Sri Lanka famous for its iconic Sigiriya Rock Fortress, ancient frescoes, and beautiful surrounding landscapes.",60919,164
343,Trincomalee,"A city in Sri Lanka known for its stunning beaches, vibrant coral reefs, and the historic Koneswaram Temple.",91051,164
344,Bentota,"A coastal city in Sri Lanka famous for its beautiful beaches, water sports activities, and the Bentota River.",28345,164
345,Ella,"A city in Sri Lanka known for its stunning tea plantations, beautiful waterfalls, and the famous Nine Arch Bridge.",87194,164
346,Mirissa,"A coastal city in Sri Lanka famous for its pristine beaches, whale watching opportunities, and vibrant beachside restaurants.",83037,164
347,Jaffna,"A city in Sri Lanka known for its vibrant Tamil culture, historic landmarks like the Jaffna Fort, and beautiful islands.",77181,164
348,Stockholm,"The capital city of Sweden known for its beautiful archipelago, historic Gamla Stan, and vibrant cultural scene.",11312,168
349,Gothenburg,"A city in Sweden famous for its charming canals, beautiful parks, and vibrant culinary scene.",10607,168
350,Malmö,"A city in Sweden known for its modern architecture, beautiful parks, and being the gateway to the picturesque Öresund Bridge.",74278,168
351,Uppsala,"A city in Sweden famous for its historic university, stunning cathedral, and vibrant student atmosphere.",89195,168
